,text,emotions,score
81,Early and mid-2020 my stress level was very high and I lost sleep about the future of our business as the failure of the business seems imminent. At that stage we ran between 100% to 60% down on revenue. The Government however eased this stress however it was temporary. My stress is impacted as all staff are whanau and we will all suffer if our business fails. Moving into 2021 was a very cautious time and our income again was 30% down on the previous summer. Winter 2021 we are 50% down and I pray that we survive to October in the hope that we can revive our business.,optimism,0.9214765429496765
82,"All of the people who were homeless at lock down were housed during lock down. This, however, has not continued post lock down. The priority for government has been to build homes, however, homeless people can't afford houses so are still in the same situation they were in pre-lock down.",neutral,0.9396874904632568
83,"As a 100% volunteer-run non-profit organisation, we felt the pinch in terms of time, finances & volunteer availability, lack of technical (online) skills, being unable to train volunteers within a short time & also being unable to support as many people as we wanted to - as we rushed to increase service offerings and to really be there for people. We worked hard to still keep going & be there for those who wanted to be supported by us - those who were feeling lonely, facing financial hardship, going through relationship issues, depression and anxiety during challenging times and also those who were struggling to find employment/ pay their bills. At the same time, we collaborated in new ways with various organisations to support people in different ways. Although times were challenging, these experiences gave us depth and fulfilment to grow and expand in many creative and innovative ways. ",approval,0.9628119468688965
84,We implemented a wrap-around service to support all whanau in our community. Whatever was identified the need was met. No holds barred We operate under a multi structure it was natural for us to Manaaki all people no matter where they came from Kai was the centre of our structure ,approval,0.9797484278678894
85,"The organization has been proactive to support staff throughout the varying alert levels and changes that have resulted from COVID. However, impacts on staff are still evident in the amount of sick leave taken and in a general perception that the staff team struggles with resilience and coping. It seems that there is a double burden of taking care of themselves/their whanau while remaining focused on taking care of clients and continuing to provide essential programming in the community.",caring,0.9002102017402649
86,Nil,neutral,0.9799578785896301
87,"I think that COVID-19 has brought our team closer together, in terms of being aware of the needs of team members and looking at different ways to be flexible and support each other. Working from a shared office space with other community groups has also been very beneficial, with many examples of the groups helping each other out.",approval,0.9698670506477356
88,"Primarily the committee relies on money from grants that we apply for to pay for our expenses, such as electricity, rent, toy librarian wages, internet, cleaning products and renewal of toys. But in the past year due to the difficulties brought on by Covid 19 no grants were applied for by the previous committee. We also had no income from late March to August 2020 (2 months after level 2 ended), due to the lockdown and families restarting to use the toy library conservatively after the lockdown. The Wage Subsidy was applied for by the previous committee but our 1 employee works 6h per week therefore, not all the subsidy was used. The previous committee also did not apply for the Wage Subsidy Extension which we would have qualified for. This means that we now have very limited funds to work with until the next rounds of grants are approved and paid out from July onwards, if we are successful. In the meantime, we have been fundraising to generate some income and being financially conservative. We only have reserves to last another month. However, repaying the unused portion of the Wage Subsidy we could have kept if the Extension had been applied is going to burden us financially for the next 12 months. This is causing a lot of stress for the current committee as we do not want to close after 18 years of service for the community and all the work that even closing would entail.",sadness,0.4580160975456238
89,We have had an increase in those seeking counselling since levels have reduced. For our community it was interesting there seemed to be a collective we have been there done that and its over when levels were relaxed and then Auckland went into lock down our community almost did a collective gasp and were over the top vigilant and were reluctant to move about the community as they had been. I think it wasn't until that moment that the realisation hit that this was by no way over.,realization,0.9959781169891357
90,"Wellbeing is our biggest issue for our organisation. Emotions and stress levels are at an all-time high, staff are irrational, people are leaving, staff are blaming each other and the want to go back into lockdown is incredibly high. The impacts of being controlled by the fear of what COVID-19 brings has been huge and we are yet to see the worst of it. We have clinical staff that are acting out, and they have the training behind them. If they cannot regulate and self-reason, then what does that mean for the rest of the organisation.",disappointment,0.8257846832275391
91,I think we should promote the urgently needed herd immunity by better strategic massive COVID vaccination ,approval,0.9843983054161072
92,We have been very fortunate to have received a substantial Jobs for Nature grant that will fund our organisation for the next 5 years,gratitude,0.2526001036167145
93,We're doing fine! ,approval,0.7765688896179199
94,Pressure on so many of our seniors who lack the skills and are concerned about online activity such as banking,caring,0.9835648536682129
95,"After lockdown, some of our volunteers chose not to continue on the front of house roster. This made it harder for the remaining volunteers. We also had a backlog of work which seemed daunting after lockdown but we have worked through it steadily and are getting good feedback from the community which cheers us all up.",approval,0.3100500702857971
96,"The effect on the elderly volunteers (as vulnerable people) threatened the continuation of our service. The contrast with paid work where one is paid by the hour to volunteer work - where one may receive a $20 gift for the year - is huge. It would be great to offer volunteers petrol or supermarket vouchers. Because we cannot, essentially volunteering is costing people in time and travel expenses. This makes the sector difficult to recruit young volunteers for, and so hard to get emergent leadership. Would be good to see a koha scheme to encourage the out of work to volunteer and build their skills.",disapproval,0.5865253210067749
97,"Our festival had to be cancelled after a launch in early March 2020. We scrambled and created an online bubble festival that got an audience of 2,600 compared to 16,000 the previous year. The programme we rolled over to 2021 and with the help of MBIE Domestic Event Fund we were able to put on a festival in 2021. That funding we used mainly to try and get visitors from outside the region to help our festival partners that lost a lot of income due to borders closing.",disappointment,0.8235412836074829
98,"Working alone as a Manager I have noticed more community emotional need from organisation leaders and those that work autonomously are overworked, underpaid and concerned for their future. Reassurance to others as been a new factor I have had to take into account more regularly. Feeling unsettled as to whether there will be funding does tend to make you feel like there may be a time to consider more options. The pressure of people turning to you for help will certainly increase and the demand for volunteers increases but we are losing the older generation we have relied on for years. That concerns me.",realization,0.525377094745636
99,It was hard to get volunteers motivated after the lockdowns to attend meetings and project work....took some time to build that up again and it is still a bit of an issue. Also getting tradespeople and materials for projects that we had to put on hold during the lockdowns was difficult and this is ongoing. Weirdly it was nice for our busy volunteers to have a bit of break during lockdown :),disappointment,0.8148694038391113
100,I'm concerned about how fatigued our sector is and the increasing reality of burn out as they try and support a struggling community.,caring,0.9919163584709167
101,"The importance of staff wellbeing and ensure that staff look after themselves and their whanau is less negotiable, it has become a priority. ",caring,0.7557125687599182
102,Within the Ngāruawāhia community during COVID there was a lot of food distribution for Māori whanau - Tu Tangata has an increase in Pakeha families accessing food parcels and general support.,approval,0.8246576189994812
103,"My life has never been busier since we went into Covid-19, Level 4. Initially it was to prepare individual H & S plans for contractors in preparation for Level 3 just to maintain the existing programme. Since then, the pace has remained elevated I feel like I'm constantly sprinting when I'm only meant to be jogging. All of the opportunity for conservation post Level 4 is so positive, but it is also exhausting and not really sustainable. ",disappointment,0.7374454140663147
104,"Initially, the staff were very stressed by the lockdown but once we became more proficient in the use of digital technology, we became more relaxed and able to use it effectively. We were also hugely supported by the Govt wage subsidy - this took an enormous amount of pressure off us. Ironically, the whole experience culminated in the staff coming together to be more supportive and united.",realization,0.4940953254699707
105,We have a few older staff members who were a bit more anxious about their health and wellbeing. We needed to be flexible in having them stay at home through the different Levels. Our sick leave rate has increased substantially as people now stay home at the slightest inkling of sickness approaching.,approval,0.6360096335411072
106,The most profound impacts for our whanau during COVID 19 was when the way in which WINZ operated in the absence of the rigid rules that allowed whanau immediate access to support when they needed help. The other profound impact was the way in which the NGO sector collaborated and worked effectively together. It would be great to have these aspects continue to meet the needs of whanau. ,admiration,0.6466213464736938
107,We kept in touch remotely & came through it well,approval,0.8687775731086731
108,"As I am 70 years+ I found I needed help from others when lock down hit. A ding to my pride but realistic too because although I value my independence, I have been very fortunate health wise and age will continue to bring challenges. After the earthquakes we were told it would take 50 years to get back to normal and I realized I would not be here. Covid told me I value and enjoy my own space but I also need community. Some of our staff/volunteers struggled without face-to-face contact and were ready to break rules just to be with people again. Some volunteers were extremely busy in their employment and faced discrimination and grumpy people but they had no time to receive support. Internet access was difficult when you had parents working online from home and children zooming in for lessons.",realization,0.8865065574645996
109,The workload has increased and valuable volunteers have to be looked after so stress levels are controlled,neutral,0.720589816570282
110,"Staff turnover has increased as staff look at options that are more family friendly - work closer to their home, shorter hours, contracting that allows more flexibility.",approval,0.9816978573799133
111,"Our clients are mainly elderly and unable to access transport. We offer a safe reliable service to the supermarket at an affordable price. During the past year mainly of the clients have felt isolated and afraid to venture out because of their fears around catching Covid 19. When we were able to return to normal service, some were still reluctant to go out but also felt like a burden to their families, friends and neighbours because they had to rely on them to fill their needs.",neutral,0.7051784992218018
112,"Staff work from home 2 days per week and 3 days in the office. Additional pressure of financial risk to organisation has increased stress levels of staff. Being a smaller team morale has remained pretty good, making sure we celebrate small successes. ",joy,0.3683047294616699
113,"The board was in good frame of mind, relaxed and comfortable. Zoom meetings gave us good connectivity. Creative people wanted to share their work.",admiration,0.765433669090271
114,Members are afraid to come to the meeting at the early stage of covid 19.Now attending with mask and other guidelines.,fear,0.9560638070106506
115,"We lost $440k last year - we were very transparent with staff. The vast majority of our staff were very appreciative of it and regularly commented on how much the valued all the effort that was being done and the fact that we didn't make redundancies or make staff take pay cuts. We did have a couple individuals that seemed to have developed an entitled attitude in this time and expected salary increases, resisted picking up extra work to help out. This caused major issues as they became quite vocal. They have left the organisation and the culture has bounced back, with remaining staff telling us how uncomfortable they felt and that when they tried to say they felt very supportive, they were then criticised or ostracised by this small group. I've spoken to a few other CEOs who have said that they had a similar experience. Vast majority of staff were amazing and doing what was needed to get through. But a small number who didn't seem to have empathy and developed an entitled attitude.",admiration,0.8298001885414124
116,Organizational cuts mean that everyone has more workload expected of them but no extra support or training. Makes it all feel a bit overwhelming and like you’re not valued as no one is about helping each other out anymore,disappointment,0.9401184320449829
117,"Our organisation has been ok, we do however understand the pressure put on the sector we support and the staff working in the sector.",approval,0.9008356928825378
118,"As we deal with animals as well as humans, during the lockdown only a few were able to be on site. This meant no breaks for them & constant stress especially during the winter months",neutral,0.9541910290718079
119,"Covid 19 lockdowns were beneficial to the environment. Fish was plentiful, and with no vehicle sounds birds and other sounds of nature could be heard and enjoyed. Keeping in touch by phone with whanau in other places was great for peace of mind, but sitting at zoom meetings for hours on end was bad for my physical wellbeing as I was sitting at my desk for long periods of time, forgetting to take a break. ",approval,0.8333722352981567
120,Some of our committee members have read a lot of information on social media that has been somewhat distressing. ,disappointment,0.9551720023155212
121,"Having to stop intensive 10-day residential courses partway through, to meet government lockdown requirement, is distressing to the students and all the volunteers serving them. ",disappointment,0.989615797996521
122,As a very small volunteer organisation there has been a big impact at the leadership/governance level where more than half of the trustees/leaders have been emotionally and mentally affected and distressed. They have not returned to previous capacity.,disappointment,0.3605828881263733
123,"Two very strong themes came out during Covid 1 in our community. 1) Many dog owners do not control their dogs. They have them off lead, and their idea of taking the dog for a walk is to take it for a shit on the footpath. Some dog owners do not stop their dogs barking all day. Wellington City Council MUST prosecute dog owners with dogs off lead or alternatively provide much larger off-lead romping areas for dogs. Dogs and their owners are out of control and this is a national issue, not a local one. 2) There are limited places to walk recreationally in our community. (Council are addressing this). As we are a small green community, lots of strangers came walking in our streets which created anxiety for some, including the dog owners whose dogs growled and barked at them. We know our locals and have a culture of questioning strangers. There were so many people walking it got congested. With the new track due to open this year, the problem will be that the dog owners will take over and the recreational walk will become fouled with dog faeces. In UK, they have banned dogs in some public parks due to the health issues caused by dog faeces. I think the time has come for Council to reconsider dogs as pets, especially in cities where the sections are now very small. ",neutral,0.8134035468101501
124,Libraries all got hit from the lockdown and ability to know how to continue giving service. One of our library’s downsides compared to other libraries was having a digital foot print so parents could organise toys to hire for that time. ,neutral,0.5922465920448303
125,"Creating a start-up during that pandemic was the craziest thing to do, everyone told me. As a solo parent and having to go back on the benefit seems like a very high risk that was bound to fail. It has been very stressful, and a rollercoaster ride, where I would often find myself looking at returning to a 9-5 job. However, we turn 1 in three weeks, and with all the craziness, leg work, knocking on doors and getting rejected, not getting paid - it's all been with it and I would not change a thing at all. The pandemic has made me look at things from another lens and take risks that I would probably not have, because it’s all about the people, or in my case the children. ",approval,0.4658541679382324
126,"I feel it’s been tougher as a manager as the emotional support needed for staff has been greater. Staff have needed more from their manager, as things have been more up and down in their personal lives. We've needed to deal with team members with different ideas of what's okay risk wise, so there's been a need for lots more conversations about workplace behaviour. This has gone well, but its draining. ",disappointment,0.5035328269004822
127,Really has not affected us,neutral,0.7665972113609314
128,"I didn't seem to impact on our volunteers. They can still sew for us at home, in their own time when it suits them. In that way it gave them something to do and the knowledge that they were still about to help others.",neutral,0.9799163341522217
129,Board members and volunteers leaving our town due to losing work in a tourist town with no new job opportunities on the horizon. Those board members & volunteers who remain in town are living on less income and often struggling to make ends meet.,disappointment,0.8533174395561218
130,Many of our members were slow to re-join our programmes after lock downs because of anxiety,approval,0.39645639061927795
131,It was hard not being able to organise events for our members and to find out face to face how they were coping. It was also hard to raise funds especially as fundraising sometimes relied on contact with the general public,disappointment,0.9606029987335205
132,"I think our volunteer community has come back stronger than ever and determined to meet the goals our board sets (in consultation with them of course). We are self-funding, 100% volunteer and working for the community. ",admiration,0.7059272527694702
133,"It is stressful booking meetings that require plane travel and accommodation, with the worry of passing through e.g., Auckland/airport/hotels at times of covid risk. Also, arrangements being cancelled owing to covid and the stress of retrieving precious funds via refunds, deposits etc, as well as the time it takes.",nervousness,0.7118852138519287
134,Volunteers look after the museum visitors during the weekly opening afternoon. For the volunteers this is an important time and seen as providing real value for visitors to the museum. The honorary curator takes the responsibility very seriously and makes a great contribution to the work of the museum. ,admiration,0.9942507743835449
135,"As we are dealing with the elderly and disabled, some of them, were reluctant to start associating with others at close proximity and preferred to stay at home. This is now not as obvious.",neutral,0.7364327311515808
136,Stressful but that covid,neutral,0.6169218420982361
137,"We implemented a 3-stage strategy as soon as we went into lockdown to help us focus. Strategy 1, which was very short term, was about member viability and looking at ways we could help them reduce costs. Strategy 2 was not so immediate and was about keeping members operating so that they could be ready for the recovery. Strategy 3 was longer term and about how the industry could be used to kickstart the economy. The sorts of support we provided changed as we worked through the strategies - from being there, supportive and encouraging (soft skills stuff), to more business oriented and factual. ",neutral,0.7727265357971191
138,"It has been hard trying to improve our programmes as you would in the normal run of things. So, a programme we were in the process of developing has stood still which can jeopardise its viability. The reason it has stood still is that we have had to devote voluntary time to other issues that originated with Covid. E.g., it took months to get a response from MSD about subsidising a potential administrators wage. By the time permission came though, they had decided to go somewhere else. That was a waste of our time, HR, consultants’ expenses etc.",realization,0.504660964012146
139,"A lot of work was put in to encourage members to attend meetings, but numbers were down.",realization,0.5319912433624268
140,We need to make it easier to have government be a part of the story in our communities financially ONLY ,approval,0.4616768956184387
141,"Housing, mental health needs have increased and organisations are struggling to provide the support needed - lack of funding, staff. ",sadness,0.6710496544837952
142,Nil,neutral,0.9799578785896301
143,Management self sufficient,neutral,0.9609827995300293
144,Staff are stressed and burning out. Loss of funding means loss of paid hours so more expected of them for less financial incentive. Burnout will be a result in the near future. ,disappointment,0.7040831446647644
145,The stress had been horrific this past 10 weeks. I cry often. The people I serve are in crisis. I am struggling not to bring work home. I am worried about suicide and other really serious consequences for the disabled people I serve,sadness,0.6292077302932739
146,Working with elderly they were slow to restart classes and were quite nervous to come out of their homes.,fear,0.6563464403152466
147,Manage Covid extremely well,neutral,0.5626413822174072
148,"I am proud of our iwi for closing our borders to protect our vulnerable people. I am also proud of the way we set up Hapū Response Teams to provide for all residents inside our boundaries, including non-Māori people we had no relationships with before Covid.",pride,0.9173300266265869
149,During the pandemic many local found our reserve as a place for wellbeing and recreation. Many are inspired by our efforts and find it a place to be proud of.,pride,0.9846333265304565
150,The restoring of connections once the pandemic lockdown had ended. Listening to their problems and putting ours down a bit in the mean time,approval,0.8486155271530151
151,"We made a priority of staff wellbeing. This has been of great benefit on our return. Similarly with students, while learning and completing assessments were important, making sure students were okay took priority.",admiration,0.7170642018318176
152,"We continued to operate the business remotely, we also picked up delivering essential items to our communities, so the workload on many of the able-bodied staff was huge. There was a very tired workforce on returning to work. The efforts continued long after our return.",neutral,0.9457233548164368
153,We had most of our IT in the cloud before Covid struck. This meant we could keep systems going. We implemented MS Teams for board meetings.,neutral,0.9811280965805054
154,We are trying our best to be available ,optimism,0.48255079984664917
155,The nature of our Trust is one that really Covid 19 has had little effect on apart from shrinking the donation base and raising the cost of inputs,neutral,0.9195642471313477
156,Our team are still concerned about the impact of covid-19 potentially re-emerging in our community which would result in us stopping our services to families. This is something we consider every day if there is another lockdown. ,caring,0.973251461982727
157,When COVID appeared in NZ and started getting a hold one of the staff reported that their partner had contracted COVID. This made us sit up and take seriously what was happening in the country. We dodged a bullet and kept COVID out. This was through a team of dedicated caring staff.,nervousness,0.6358906626701355
