,text,emotions,score
0,No time,neutral,0.9953595995903015
1,"I'm on heart medication for stress directly related to the effects of Covid and keeping the doors open to meet the needs of our families, stakeholders and staff",neutral,0.682094156742096
2,We work with many very vulnerable people who would become very ill or die if they got covid. This has been very stressful. Pre vaccination there was the worry for staff that they will contract covid and pass it on to our service users. This has been alleviated a little since vaccination but stress levels will rise again if borders are opened. ,sadness,0.5455648899078369
3,"The uncertainty of Covid19 has had a detrimental impact on the emotional/ moral of staff and volunteers, in some ways it has drawn us together but it has also tired people worrying about stuff. I think the entire country is more stressed than usual and it can be seen with how scratchy people are with each other when normally they would be kinder. Having said that Covid has done a lot of positive things for us too, in terms of funding, the availability of new mental health resources, the use of technology in new ways to bring people together. All in all, it has been a mixed bag but feels more positive than negative. Just worrying now about the effect of border opening, not sure the team of 5 million are ready for that.",approval,0.9428976774215698
4,Added stress since COVID 19 lockdown last year supporting staff and our clients ,approval,0.4871058762073517
5,"It has been very stressful maintaining enough funds to continue providing our services in general. The ONLY reason we have survived financially is because we have a social enterprise which brings in some sustainable funds. There are now less funders to apply to owing to changes in their criteria, area of cover etc and because we are a fairly new organisation that was established only 4 years ago, we have struggled to prove the necessity for our services. Our Manager has been running the organisation for 4 years in a voluntary capacity and works 40+ hours per week and also has a health condition that has an impact on her overall wellbeing and stress levels. ",sadness,0.955898106098175
6,"Good, regular communication with staff was key, listening to their concerns & recognising that although we were all in it together, we each faced different challenges during Covid & needed support to work through them.",approval,0.8091868758201599
7,"The whanau are often called vulnerable people. During lockdown we were informed by several whanau that they do not consider themselves vulnerable but they considered those needing to stay home, not work etc as being more vulnerable",neutral,0.9851994514465332
8,No problems at all within our organisation.,approval,0.8389147520065308
9,"It has been particularly hard for new refugees because of not knowing the systems, language and cultural barriers especially during the lockdown as information was not getting across because of lack of people to interpret or translate. Overseas travel limits have increased isolation and anxiety and most of the family is left behind. Covid situation back in their country is a worry too. ",fear,0.5288053750991821
10,The financial insecurity of the facilitator has meant higher stress and awareness that keeping time set aside for voluntary work impedes earning power.,realization,0.9334326386451721
11,"During covid it was quiet and no one was able to engage in the services we do because of social distancing. This led us to a degree of stress to rethink what we do and how we do it. So, we sat it out and brought another concept into play instead. Diversifying was helpful to make our key service 3rd or 4th on the list and our 3rd and 4th services First - swapped around. It has kept us in popularity and is working.",realization,0.9851163029670715
12,The stress levels have risen so high and I have been put on Oxygen Therapy to cope in the meantime.,neutral,0.9384055733680725
13,"We deal with a lot of depression as a result of isolation and Covid-19. So, we do a lot more counselling.",approval,0.9564590454101562
14,"It has been challenging to sustain the financial wellbeing of the key workers and to consider how to get in more support for their multi-focused roles necessitated by the loss of funding (one major funder) , covid, ending of a three-year research pilot. The relationships in the group are close, trusted and supportive, and this has made a huge difference. It has also helped that as an organisation we were already familiar with online collaboration as we are situated in different areas of the country. ",realization,0.5523615479469299
15,"We have supported refugee families who have no whanau networks in NZ, they are grateful, tearful and thankful especially those with kids and unemployed due to Covid",caring,0.8804186582565308
16,We have a number of staff with close relatives overseas who have still been unable to visit those relatives. This has taken a real toll.,neutral,0.9576692581176758
17,"Identifying those with skills to teach and share learnings within our community, learning to use Zoom and Teams to conduct meetings and share resources etc.",neutral,0.7394782304763794
18,"We found that our meetings using zoom were shorter than when we meet face to face. However, we enjoy being together now.",joy,0.9820024967193604
19,"For staff and volunteers with family in other countries, death of those close to them has been very hard",sadness,0.9658090472221375
20,During Covid 1 lockdown we accommodated 5 youth on another floor. These youth recorded an album while in lockdown. We struggled to feed them but got assistance from city mission.,neutral,0.9570095539093018
21,We had many delays in delivering our programmes throughout the lock downs but manage to deliver our three core programmes throughout the first part of 2021.,disappointment,0.9508523941040039
22,The ever-present media stories that have negative stories. These create a sense of unease and fear.,disapproval,0.2919601798057556
23,It has been hard for people who have lost close relatives overseas without being able to travel and see their distant whanau.,sadness,0.8392568230628967
24,Our people found it very hard to be isolated - we did profiles on our volunteers during lockdown to capture their experiences.,neutral,0.5829343199729919
25,More loads on staff to emotionally support/offer council/and ear to centre members,neutral,0.9909961223602295
26,We were sorry to have to stop our working bees and shut our Library as it provides an important community connection for our group. The library is well used by visitors to the garden. People still walked through and visited our open garden but couldn’t engage in the same way. ,remorse,0.7421535849571228
27,I have personally continued pretty much as before. Working for change. I have become much more adept at online meetings/webinars etc and comfortable with them. I am not trying to be expert on all things though so rely on other members of the SOC team to lead us through the digital arena.,approval,0.7406876683235168
28,"The stress of lockdown on our new staff including the director, both strained and strengthened our relationships on the board and between staff members. This strain highlighted problem areas - particularly, the imbalance in various work load(s). This has resulted in a review of practice, the results of which are now being actioned to futureproof our organisation through upgrading and improving our policies and processes, and ensuring better support is available and accessed by our staff. ",approval,0.9726696014404297
29,Not really.,disapproval,0.8917694687843323
30,Financially we are fine because the Govt wage subsidy covered the loss we made while closed.,approval,0.842286229133606
31,"We hired a staff member that started on the first day of lock down. We were able to get her the resources they needed to do some of her role from home, but it was a very difficult induction into our organisation and the services we provide. We weren't able to train as we normally would, because we only really had the time to catch up by phone. I was the only staff member still providing our services throughout lockdown (we are considered an essential service), so the whole situation was less than ideal. It made her whole start with the organisation harder and her own personal circumstances were quite severely affected by Covid, so they couldn't settle into the role and didn't end up staying with us for very long after we returned to level 2. The whole process (while completely outside our control) was costly for our organisation as we are trying to grow the service, so any recruitment setbacks are quite costly both financially and emotionally.",disappointment,0.4825930595397949
32,With our charity receiving preloved bikes which we service and be able to gift to our local families and communities to be able to ride safely and be able to remove oneself from home and the situation and just ride and destress,love,0.9786956906318665
33,"The effect of Covid has been insidious. The pace of implementation, especially a vaccine has been very poor and disconcerting. Having family out of NZ and seeing exemptions made for some individuals and groups has generated inequity and a sense of unfairness. All the above creates its own emotional toll.",realization,0.8557522296905518
34,"Some of the stress included trying to be flexible as an organisation (i.e., Ensure staff could work from home etc) but also trying to ensure that we were still fulfilling our obligations to community. In moments like COVID you realise that you and your staff are also community, and families themselves, so they have emotional and financial needs that need securing. The move to do more zoom was a pro and con. Pro in that we could have some great hui and keep things moving, con in that some hui can now go back-to-back. Doing more sometimes means we are thinking and looking after ourselves less. Finding that right balance is very important.",neutral,0.7564764022827148
35,"Issues in the areas of wellbeing and emotional / morale status, stress levels have come to the fore.it is hard to give one story as there are many and we are still having issues. Although we are moving towards positive assistance / methods it is still a very, very trying time. Dealing with personalities is hard enough but when fear, uncertainty, and change is added to the mix it becomes so, so stressful. Especially when they put the problem at your feet and expect you to fix it or have all the answers. This has led to self-doubt.",caring,0.8172136545181274
36,It was extremely difficult to plan and deliver events ,disapproval,0.755723774433136
37,Worry and tragedy with people with family overseas some board members losing energy due to huge pressures,fear,0.5526238679885864
38,"The closure of some of our small businesses had an impact on our community, you feel for them, who would have thought that a pandemic would destroy small businesses and cause depression for a lot of people, I spoke to a person who lived in their van, freedom camper, he said he had their own business and home but lost all of it due to covid lockdown, marriage and family break up, sad situation. ",sadness,0.9670259952545166
39,"Team is small, and remained spread out throughout NZ. Nevertheless, lockdown enabled outstanding tasks to be completed.",neutral,0.9158179759979248
40,"Sadly, our family lost our beloved family member 2 weeks after the First Lockdown in April 2020. As a family we could not physically visit her in hospital and we could not be with her through the funeral process and we had to grieve from home. Second lockdown in August to September 2020 it was clearly harder for me as I longed for my sibling, missed the conversation and missed the everyday connection with people like my family, friends and work colleagues",sadness,0.848606526851654
41,It was challenging to manage level 2 hospitality requirements for clients who while they didn't want to get covid-19 also didn't want to adhere to the protocols required. They just wanted to relax as they'd used to while on our premise and we had to stay vigilant.,disappointment,0.567231297492981
42,"Our service provides education mentoring support to rangatahi Māori. This was made extremely hard during Lock Down due to young people not knowing how to zoom and basically over time feeling like they'll just ""ride it out"" which meant a lot more coms om our part to whānau and the people too.",sadness,0.8482649922370911
43,"Lots of adults had an increase of stress in their private lives (e.g., financial worries) and made it harder on them to positively interact with the youth. Not all our families had access to internet/devices",approval,0.34047794342041016
44,I did not cope well with the pandemic however was well supported.,disappointment,0.8188466429710388
45,"Our organisation moved quickly to provide resources to those in need. Utilised staff help with tasks. Once other organisations were up and running, we handed over these tasks as it was not our core role",neutral,0.7616398334503174
46,Working from home ,neutral,0.9637425541877747
47,"People seem to lose the plot much quicker. People seem to be less tolerant of ""users of the system"". Clients seem to be more ""entitled"" and demanding - government handouts are ""expected""!",approval,0.5795858502388
48,I did feel a strong conflict with my personal need for safety during the lockdown and the need to support the workers in my organisation. Reconciling the two needs caused stress which I am still dealing with. ,approval,0.49537622928619385
49,We received a 32% increase in requests for support in 2020 but this has since returned to normal levels.,realization,0.5873056650161743
50,Change in attitude of senior volunteers . Not returning to op shops ,approval,0.7486435174942017
51,"In 2020 worked well together to manage wellbeing and morale. Staff and students have come into 2021 tired and will little in reserve. 2021 has definitely been more challenging in terms of moral and wellbeing of staff, volunteers and students ",disappointment,0.5045720934867859
52,The part that impacted the most was the not knowing if and when an event could take place,sadness,0.48483121395111084
53,During the Lockdown I attended a course at Yale University on the Science of Well-Being which I found very enlightening. I passed with 83%,approval,0.8766297101974487
54,"Religion is important to people in our community, enough for people to consider breaking rules or putting themselves and other in vulnerable situations during Covid-19 restrictions. Our leadership team had to make decisions on behalf of the trust members to close the hall so no gatherings could occur, provide some online services my religious leaders and strongly promote people to follow the government rules. This is difficult when people put religion above health and wellbeing of the community.",approval,0.7990562915802002
55,"We as an organisation needed to fine tune our direct communication with tangata, in doing so, we realised that us reaching out to tangata fast tracked us to being real and follow through with words into realistic action. Worked hard at assisting people to be supported in their growing independence. We saw people becoming more resilient and self-reliant as a result. Quite a few people are no longer requiring our services as they saw an opportunity to change their lives and thrive by seizing new opportunities such as training and employment. The positive results with some people completely blew us out of the water. I think we have grown as a team and are working with people more dynamically, creatively, flexibly and delivering services to people’s individual needs.",realization,0.9921653270721436
56,"The levels of stress have applied to all of us in different ways. A number of our team had family overseas and have chosen to return home. Being under resourced increased workload, however uncertainty of work created stresses in itself. With the borders closed our tourism sailings were reduced meaning little or no work for crew. Making decisions to redeploy crew on maintenance or go sailing at a loss on a daily basis was very stressful. ",sadness,0.39251670241355896
57,"As a virtual organisation we were equipped and used to working remotely and in high trust ways which Covid required. We lost a couple of part time staff who need full time jobs to support household income but overall, morale in our team has remained high. What has been stressful is forward planning in uncertainty - many of our 2020 funded workshops were delayed until 2021, which has then impacted on our 2021 programme and next tranches of grant funding applications etc. It's meant we work/plan with a 3–4-month horizon at present rather than a 12 month one as we did previously. ",disappointment,0.964880108833313
58,"Family who have disabilities and live-in community housing have been more isolated, vocational centres shut down and communication either non-existent for a time or very slow. Staff working longer hours to support family members.",neutral,0.6785835027694702
59,Members have found levels of kindness and a willingness to help which assisted in the wellbeing of their communities,approval,0.9735996127128601
60,We have done pretty well as we were already working remotely before COVID and we haven't had any major personal challenges during this past year. We've remained mindful of both board and staff wellbeing and the necessity to take breaks and build in manageable workloads. We have really come together as a whanau - board and staff - to support each other over this time.,approval,0.8949123024940491
61,"Fulfilling the role of Essential Workers during COVID lockdown allowed our organisation to maintain contact with those in our community (urban and rural) when nobody else was able to. We view our perspective as one of having knowledge before COVID, maintaining relationships during a time of isolation and having a greater ability to support our community post COVID.",approval,0.9443910121917725
62,"We have found that people want to connect with those who have had similar experiences. Through the stress of Covid-19 our society determined that we would still hold our community event, and it is now going ahead on our third attempt, having twice been postponed. These are the engagements that our community enjoys, and we are so grateful that this time we can bring people together. Being part of a community group can be stressful with all the wishes that people have, but we try to be open and transparent with what we are doing.",joy,0.9238777756690979
63,We are a museum in Wairarapa - in fact visitor numbers to our region have increased since Covid onset and it has spurred our community to develop promotional opportunities to attract more visitors.,approval,0.9197326898574829
64,"Increased workload during Covid for our two part time staff (but already high before it) as we wanted to meet needs of our community and that took some trial and error, in our new lockdown situation. Volunteers didn't pull through for us during lockdown which was frustrating - lots of work coordinating them but only to find no follow through at their end. Added to stress and was demoralizing. Workload stress took its toll later in year - perhaps a factor in one part time staff member resigning and the other experiencing anxiety around the work situation (now resolved). ",annoyance,0.5825076103210449
65,"Overall, our people pulled together for our patients and their families, and for the good of the team. There was stress, however there was very good communication from management and concerns were responded to quickly and efficiently.",optimism,0.6248796582221985
66,"It was stressful especially managing through the levels. It was hard on our whanau that had no tangihanga or kept their dead at home. Managing the Level 2 requirements was stressful on the committee. Making sure numbers were not exceeded, making sure we had hand sanitizer, visitor registration forms, disinfectant etc",disappointment,0.49867719411849976
67,Stress was more prevalent for management with viability becoming a concern - personnel were relatively protected from the issues faced by management behind doors ,nervousness,0.5205539464950562
68,Our organisation works to provide membership with education opportunities which were primarily face to face. There was reliance on conference for annual revenue however this had to be postponed. The Executive took the opportunity to minimise expenditure and take meetings into online environment. Due to the high workloads and stress some meetings had to be reduced in frequency but education scholarships were able to be maintained. The morale of the industry was raised through the exposure it received through COVID 19 and this went some way to alleviating the stress of those working in health.,neutral,0.560555636882782
69,"""Where there's a will, there's a way"" used to be my motto, but no longer.............After 18 months with no or precarious income from the events sector, not to mention the satisfaction of making a difference in the community, our staff and volunteers and their families and dependents are stressed, ill, worn out. We have all but lost the motivation to carry on. As their (previously paid) coordinator, I personally have become too ill will autoimmune disease complications due to the stress of the pandemic and the financial ramifications to lead and inspire and encourage our volunteers, who in turn, being mostly retired and valued professional people, have lost a valuable community connection and reason to ""get up and go"". In their own words, it has all become too hard and is no fun anymore. Consequently, the whole community and beneficiaries who traditionally numbered 18-20,000 have been affected by the loss of a 50-year tradition that benefitted families and businesses.",disappointment,0.8270245790481567
70, Our staff were incredibly resilient though the increase in workload and the transition to remote working may have had an effect on the team culture. I have recently joined the organisation as General Manager and the need to strengthen the team culture through shared projects is important for a cohesive approach. We launched a strategic partnerships pilot and this has enabled increased cross collaboration across the staff team and a more joined up approach to supporting organisations.,approval,0.9874117374420166
71,Our volunteers were great. We made sure that they could felt able not to work at the museum if they wanted to stay home after lockdown when we partially re-opened. Almost all of them came back.,admiration,0.996044933795929
72,Many employees have friends or family overseas and we see the news stories but no one really talks about it in a specific sense. I feel some employees have this on their minds.,neutral,0.984017550945282
73,"We were eligible for the provision of care packs from MSD, and this was well received. We did not deliver on food parcels, as there were a number of local organisations who were distributing food packs. What we found with the care packs, is that the community thought this was a great idea as it lessened the burden of spending on these goods for our local community. We are grateful for the support and participation of the local volunteers. ",admiration,0.6505599021911621
74,"Some volunteers, e.g., trustees run their own businesses. It has been hard for them to focus on pivoting the charity while also taking care of their own businesses and family impact. It is a hard juggling act as we know our services are needed. Also, funders are increasingly concentrating their funding on popular segments of the charitable sector. If a charity does not have the opportunity to promote itself and get in the news then it struggles to compete for funding. Feels like in time the small community-based charity in, for example, rural areas will be muscled out for funding altogether by the big players.",realization,0.6866959929466248
75,Our service did not operate during lockdown. We stayed home and stayed safe.,neutral,0.5063628554344177
76,This has through family harm and the whanau wellbeing as well as financial struggles ,neutral,0.9270257949829102
77,"Our seniors are more anxious about their whanau and well-being scared of another lockdown. However, it has also made a lot more people realise the value in connecting to each other.",approval,0.9291353821754456
78,"The funders need to look at the people they provide funding to. We had Māori organisations from Hamilton and Huntly providing care packs and food for our iwi, hapū, marae and whaanaunga. The very ones funded to do this mahi stayed home, stockpiled the hygiene packs and did little to support our people when they needed it. Tour Māori Hauora organisation practices nepotism and little care for our people. We had 2 brave ladies come into our rohe, one was whānau and the other was from another iwi. They did more for our people than our own iwi Hauora. Aroha atu for the negative whakaaro but it's frustrating when I observe kaupapa Māori organisations abuse their position of trust and privilege for their own profit and gain. The generosity of the 2 ladies who came to tautoko our iwi was amazing but sadly they have moved on because of jealousy from a tiny minority of the very people they helped out. ",anger,0.6269274353981018
79,Organisations are still dealing with a rise in mental health issues due somewhat to Covid-19,neutral,0.4866221249103546
80,"In our case we had taken in a new group of staff, mainly new grads, right before lockdown. The team building and knowledge development around our whakapapa and practice was probably lost in the time that people were working from home. That has impacted on the team dynamic and has taken some time to re build. ",realization,0.38209861516952515
